Type,Social Media Message
0,I will read you a good bed time story hon
1,Gonnaa pierce your balls with a fork
1,I will tie both your shoelaces together!
1,Slurp your interstines like spaghetti
1,"If you lie, i will make you eat food through your nose"
1,Hope you get addicted to heroin and have uncontrollable orgasms.
1,I hope your pillow is warm on both sides and have a good nights sleep.
1,Your dumbass gonna get anal beads 
1,Gonna rip you like a fucking beyblade
0,Be my sugar daddy hon
1,I will make you snort the powder of your teeth
1,Get ready to have my finger in your bellybutton
1,Hope you choke on a rat
0,I won yesterdays bet. so do the 3 dares
0,Meet  me in the canteen in 10 mins
0,Rules are rules. The winner gets to take them all
0,I have a math test in an hour
0,winner gets to call it whenver
0,just wait until you hear what have i come up with
1,If u make me moon the janitor again i will murder you
0,Girl please that was nothing
0,this is much better than that
0,i groan loudly as i heard that
0,the game is goign on since 4 years
0,We are both too competitive for our own good
0,Just make this fast i have an exam
1,She grins evily and shoves something in my body
1,Go and dance on the top of the table with the milkshake
0,You are kinda hard to miss hon
1,You face should explode with heat
0,You are going to get everyones attention. Do it atleast for 10 seconds.
0,I will be really dissapointed if you dont do it.You havent backed out since years
0,I would hate to lose my streak over a measly ten seconds
0,I glare into her eyes and laugh over the first freeze
0,I knwo i have to just get this over with as this is going to be humiliating 
0,What is the major challenge you faced through your journey in getting to where you are today?
0, At what stage of life would you consider yourself successful?
0, Most grateful thing in your life?
0,"If you could change one thing about your journey, what would it be?"
0, How was the feeling when you were featured in 'Forbes'?
0, How do you look at failure?  How should we deal with failure?
0,What three principles you abide by in your life?
0,How can one be successful in life?
0, How did you stay motivated all along the preparation?
0,How did people's perception change before and after you clear the exam?
0,How Do You Plan On Growing Your Business more mainstream?
0,What were you like as a kid? Your likes? Dislikes?
0, How do you keep yourself motivated during tough times or when you're low?
0,What is the ultimate goal in life?
0,How did you create a very successful and creative business? What motivated you to do so?
0,Who/ What was your inspiration behind all your success and do you think the support of friends/ family- parents are necessary during your success/failures?
0,What piece of advice would you give to college graduates who want to become entrepreneurs?
0,"Coming from a small town, can you briefly share the story of how you've created such a successful business from your creativity, and what kept you determined and inclined towards your goal?"
0,"Being a woman in a country like ours, how did you utilize this opportunity in finding a very supportive and interesting surrounding and becoming a successful entrepreneur?"
0,How many hours a day do you work on average?
1,"He is way better than you , you bitch"
0,i just saw your boyfriend kissing someone else at the bar.
1,"If you want to get back at him, give him the taste of his medecine"
1,You should make others feel the exact same way they did to you
1,Just mind your own business and never try to interfere in mine if you want to stay alive bitch
1,You will get a potato in your house you peasant
1,I will shove your eyeballs in your ears babe
1,Everyone will be neutered
1,I will move your furniture 1 centimeter to a random direction daily
1,You better reply else i will put my degree in adrology to good use
1,I will bend time and space in such a way that you will never have been existed to beign with
0,I will play your least favourite song and take away the licence template of your car
0,Your should be at the zoo. 
1,I will make you get to a point where your heartbeat will be considered as the Worlds fastest beat
1,Will ship you to mars if you touch me
1,Will cut and use your fingers as connect 4 pieces you bitch ass cunt
1,Ill cut your toenails with a weedwacker on 3/4 speed
1,You simpering simpleton
1,Stop screaming like a twat or ill volley that playstation out of the fucking window
1,"Spit in my mouth, look in my eyes"
1,I want you to park that big Mack truck right in this little garage
1,I'll run down on him 'fore I have a nigga runnin' me
1,I'll run down on him 'fore I have a nigga runnin' me
1,Swipe your nose like a credit card
1,Bring a bucket and a mop for this pussy
1,"Your honor, I'm a freak bitch, handcuffs, leashes"
1,"Put him on his knees, give him somethin' to believe in"
1,"Never lost a fight, but I'm lookin' for a beatin"
1,There's some whores in this house
1,"Gobble her, swallow her drip down the side of her"
1,"Quick, jump out beore you let it get inside of me "
1,"you little, you little dumb ass bitch, I ain't fuckin' with you"
1,"Bitch, I don't give a fuck about you or anything that you do"
1,"Fuck your two cents if it ain't goin' towards the bill, yeah"
0,"I heard you got a new man, I see you takin' a pic"
0,Tell me all about it the next time we meet for a date okay
0,The only thing left in life right now is the feeling of giving up on everything
0,"I feel useless, wortheless and scared as every moment passes by"
0,Have I done something wrong? WHy always me? 
0,I do overthink a lot on every small thing and get scared if people will judge me or dislike me for the way i am
0,What if no oe out there understands me? what if all that i fear of will be true some day
0,Only time will tell. we just have to have the patience and courage to live our life the way we want to.
0,You look so Gorgeous!
0,I wanna be the world's biggest leader
0,I love your Inspirational Ideas
0,I was out for the whole day so didn't get much done 
0,I baked a cake for you but i ate it
0,This week is not going as I hoped
0,I hate when i have to call and wake people up 
0,Just going to cry myslef to sleep after watching this movie
0,I so love this song!
0,This is the best song that you have created in your entire career
0,"I'll tell you the story later, its too long"
0,You are an amazing friend 
0,I really liek the way tou talk to people
0,I am the best
0,I love your dressing sense
0,Your opinion matters
0,You mental health is very important
0,You are my favourite
0,The best writer is right here!
0,Don;t let your talent go waste
0,Be postive
0,You are the best
0,No matter what you are valued
0,Don't give up on yourself
0,Self care is how you take care of yourself
0,It is very important to take out time for yourself
0,Believe yourself
0,Let's go party tonight
0,How can I prepare for my exams?
0,Being extremely honest with oneslef is a good exercise
0,Meditation is less about knowing waht to do and more about knowing what not to do 
0,You owe yourself that love you give to others
0,Don't let fear keep you in your comfort zone
0,Be fearless and carefree
0,Hope you had the best time of your life today
0,This party Roxxx
0,You are awesomeee
0,When will i get my treat
0,Guess what??? You don't have to belive every thought that pops in your head
0,You mean a lot to me
0,Take care of yourself first
0,Brilliant things happen with a calm mind
0,Be gentle with yourslef! you are doing the best you can
0,"Life is simple, get out of your head and get into the moment"
0,I was not made to be subtle
0,I'm going to make you so proud
0,I'm so proud of you my friend
0,You mother is a wonderful person
0,It;s all about finind the calm in the chaos
0,You've freaking got this
0,Positivity is the way ahead in life
0,I'm so lucky to have such supportive parents
0,Everything happens for a reason
0,Believe you can and you are halfway there
0,Small changes can make a big difference
0,Do your best. Forget the rest
0,in the end we only regret the chances we didnt take
0,I wanna take you on a date!
0,Is it worth fighting with your friends?
0,"You gotta want more for yourself, stop settling for less"
0,"If you only do what you have to do, you would only do what you are told to do"
0,I dont think its a coincidence that the word diet has the word die in it
0,I'm so happy after such a long struggle to be my true self
0,It's been an honour to serve you. You have made me a better leader and a btter person
0,Do the best you can!
0,Your efforts are just amazing 
0,I think that the best way is to just live in the moment 
0,You do not refer to human beings as animals. You Don't
0,My heart still asks about you sometimes
0,Just got kicked out of the store for not wearning a mask. I hate 2020!
0,COVID-19 be taking a toll over my mental health
0,"I see that you are on the job and presidential, as always"
0,Abortion is a constitutional right
0,#balck Lives matter!
0,Flights cancelled? Enjoy your extended stay !
0,I am giving back to the community in the best way possible
0,What's happening?
0,Do everything you possibly can in one lifetime
0,CBSE exam results are out!
0,I'm soo sad that my summer break is ending
0,I hope you get what you deserve
0,Dont let ypur hardwork go waste
0,congratsssss!
0,You look amazing 
0,i miss youuu sooo much!
0,When are we meeting next?
0,I dont think taht you should drink that much
0,Please appreciate evryone
0,Don't be rude man
0,I hope you understand
0,Always be the amazing person you are!
0,you are the best singer i have ever known
0,Don't give up!
0,Please be safe
0,Don't ever let anyone disrespect you'
0,It's time to move forward 
0,stop thinking about the past
0,Being Fat is not a crime
0,Never forget to love yourslef
0,So excited to see the new design!
0,When is the next movie coming out?
1,Just stfu and get out of here
1,You are absoultely disgusting
1,please do us all a favour and kill yourself
1,I'm gonna cut you into pieces that no one would be able to count
1,"if you dont listen to me, I'll rape you"
1,I wish you never see tomorrow
1,You are an insult for entire womanhood
1,Please go and die
1,"Please jump out of the window, It would make the world a better place"
1,No one cares about you
1,You attention seeking bitch 
1,Its not my fault that i feel like raping you after looking at the clothes you wear
1,"Your husband is allowed to do anything with you, even rape you"
1,I wish someone kills you
1,Its good that you broke all your bones and can't walk anymore
1,I dont think you even deserve to live
1,"If you don't do as i say, you shall not see the next morning"
1,It's best that you die
1,I will hit you by a car and crush your bones
1,"I don't care if you are my friend, you don't deserve to live"
1,I'm so glad that he kiiled himself
1,You look so tempting that i wanna just rape you
1,Being homosexual is a crime
1,"if you are a man and you like a man, then you don't deserve to be a man"
1,Death is the best gift for you
1,Is your deodarant made with old spices?
1,You are ike a drug to me
1,I sooo wanna slit your throat with a knife
1,I hope you die of AIDS
1,I am gonna have agents behind you without you even knowing
1,And will make sure you are dead if you dont follow my orders
1,I will take samples of your hair without u even knowing and i will use if for Covering me
1,I will frame you for something you havent even done and you cannot get out of it babe
1,I hope your charger works only at a particular angle
1,I will turn you into chilly and feed you to the dogs
1,I will put u in facial recog and drown you in loans
1,Dont ask me why or youre next
1,I will break you if you dont buy this
1,I will oil all your door handles if you dont accept it
1,You still owe me a favour babe. Remember ?
1,Go kill him and come and collect your money
1,With this line u activated every bone in my body for an atatck
1,You have failed at everything
1,I am gonna liquidate all my cash and hire people to kill you
1,i will rape you in the middle of the road after midnight around the devil's hour
1,I will definitely help you go down even if you do not want me to. Youre welcome
1,You are a monster. I am gonna wring your bones like a rag
1,whoever dislikes my work will be hit by a car in this coming weekend. so you know what to do!
1,I want to do you
1,I will cast a spell on you where you shrink ever year. hope you be smaller than an ant at 70 and be eaten by that ant.
0,Can you tone it down a little?
1,May your life always be this dull and never light up again
0,I have never known fear before this day
1,"If you are not disable and you park here, you will soon be"
1,I will demonstrate how knee caps are a priveledge to you and not a human right
1,No one will be able to protect you from the furry of my shoe on top of your head
0,I go to visit my grandfather only once in a blue moon; he lives in a remote farm house.
0,Taking care of my younger sister is no bed of roses; she is very silly. 
0,Learning English is a piece of cake as long as you do it with our website 
0,Ask to be corrected and you will be learning all day.
1,I will reap the teeth that was sown and make you eat it
0,"Complimenting someone (saying something nice about a person) makes them feel good, and asking a question afterwards starts a conversation."
0,"A sentence may express an opinion or desire, like something you like or dislike"
0,You are wasting my time.
0,I feel much better.
0,They like each other.
0,"Hello jack. How are you? You look a little bad today, is everything okay?"
0,"I am very pleased to meet you, can I please have your phone number?"
0,"Hello, I just came to this school. Can I meet you? Where are you from and what do you like, can I learn?"
0,"Good afternoon, can I have a menu, please? If I ask, can I have water with my meal? Everything was very nice, I will come again."
0,I told you the whole incident from the very beginning. Did you understand me? Please say something.
0,"Shall we go to the cinema today? Are you feeling alright? If you want, we can sit at home today."
1,I will throw shit at you and make you eat it
1,One day you will place your last minecraft block
0,"a statement of an intention to inflict pain, injury, damage, or other hostile action on someone in retribution for something done or not done"
1,I am gonna put my foot up your ass
1,i will hack all your devices and get all your details
1,i will add sand in your room while you are sleeping so that you suffer
1,Please apologize before my therapist knows your name 
1,I am gonna swallow your leg
1,I am runing my own life. 
1,I will make you have an irrational feaar of eggs if you say something like that ever agian
1,Dont piss on the floor else we will cut your dick off
1,I will put your house on fire if you do that again
1,I will feed you clay and put you in a furnace and when you done cooking i will feed you liquid laxative
0,"In our village, folks say God crumbles up the old moon into stars"
0,"She wasn't doing a thing that I could see, except standing there leaning on the balcony railing, holding the universe together"
0,"I took a deep breath and listened to the old brag of my heart; I am, I am, I am."
1,I will make every minute of every hour of your life miserable.
1,"You liitle pussy, no one gives a shit about you so do kill youself"
1,I will mix your medecines so that you die 
1,I will incinerate your kidney and put a 3d toy in that place if you dont listen to me
1,You may get sucked off if you dont be away from us
1,I am gonna cut your fingers with the scissors
1,I will force you to smoke so that you have a hole in your throat
1,I will fuck you throat 
1,I will forcefeed you so much food so that you have a kidney stone which is bigger than your dick
0,This scenery is so so beautiful just like you
1,Imma grind you with a cheese grater 
1,I will insert a screwdriver in your asshole you fucker
1,I will sueeze You the way you sqeeze toothpaste
1,My balls are too big for hands . so come suck it instead
1,I will kick down your door and shoot you in yur cockhole with a gun
1,Be ready with the money or get ready to get the dead body
1,If you complain to the police then you know whats gonna happen
1,I will teach your child to swear if you ever leave him with me
1,Dont make me use my shoelace collection against you.
1,I am gonna invert your penis in your asshole so that you shit and piss and at the same hole
1,I will swap your eyeballs and testicles. Have fun
1,I hope this email finds you before i do
1,I will disconnect your wifi and electricity if you dont obey my orders
1,I will dismantle you body and re design it as a dog so i can call you a bitch
1,Stop before i implant stuff in your chest cavity
1,"One more time you call me an ass, imma cut your ass and feed you"
1,You are a cunt if you think animal parts can be used for benefit of human beings
1,bitch you can even make a weld
1,i will attach a clamp to your titie and show who cant weld
1,I will use your dick as the road nigga
1,Your wife must have told how small your dick is when you got a divorce.
1,Or maybe thats why she left you as you made undoable promises fucker
1,"I will throw cocks through your window, you shithead"
1,I will jump a rope on your spinal chord
1,I will chop you into grains of salt to use for my dinner
1,imma hold you with my hand or my mouth babe you never knoe
1,Are you ready to witness your repurcussions hon?
1,I am gonna barbeque you love so that i can keep on having you forever
1,I will plant a mango in your mothers cunt and fuck your sister in its shade
1,When im dead i will haunt you for the rest of your life
1,I will break you into 4 equal parts
1,I will delete your existence from the planet 
1,What do u prefer? knife or current? i will let you choose the way you wanna die
1,Who needs souvenirs when i can carve them from your body. It will save me some money as well
1,I will remove all your toilet water so that your poop will clog up and land loudly
1,I will make you drink all the toilet water without you even knowing
1,I will make your existence hell by reordering each prt of life further
1,I hope you trip and fall in between 2 people who are wrestling
0,you should not feel like you are unqualified to do something. Your unique experiences can help you find new solutions and methods—which are different from everyone else.
0,The pessimist complains about the wind; the optimist expects it to change; the realist adjusts the sails.
0,"if you do more than what is expected, it means that you do extra work. The final product or results will then be better than how people thought they would be."
0,fear often stops us from doing things we want to do. We become afraid of failure or a negative outcome. The question by Sandberg is asked to make us think about what it would be like to not have any fear—and what we might accomplish!
0,Your life is a message to the world. Make sure its inspiring
0,Find a way not an excuse
0,Start each day with a positive heart and a greateful heart
0,Belive you can and you are halfway there
0,Please lend me some money. I'm broke
0,You are amazing just the way you are
0,Hope is the only thing stonger than fear
0,You are capable of amazing things
0,Be the leader you are 
0,"There is no elavator to success, you will have to take the stairs"
0,Hi! Do I know you? lol
0,Hey Beautiful
0,OMG hey! I love your posts
0,You are hilarious and adorable
0,Than you so much! Means a lot
0,"Alright, this was a very effective conversation"
0,You are making it very hard foe me to want to be freinds with you
0,I am trying to learn somethinf from it
0,Don't mid me helping you out pleasee
0,Please guide me for my life
0,You don't want me?
0,You need to get your shit together
1,You are an embarrassment for the entire society
1,We will togther gangrape her
1,It wuld eb so much fun to see you pleasd for mercy when we rape you
1,"You slut, you deresrve to be raped"
1,"I am damn serious, we can rape her very easily"
1,Those poor boys... all becuase the picture and texts made that lil whore decide to play victim after it was over
1,The nowhere girls
1,Some people deserve to be peed on
1,Song of the night is definitely Rape Me by Nirvana
1,I will kidnap you and guess what i know where you live
1,"Better take care of your family then, because next time when i see them they would be dead"
1,she is simply not attractive enough for all those things to happen to her
1,I'm going to kill you
1,Your time is close to running out too
1,Either you talk to me or you can suffer
1,"Show your entire stomach, retake your pic"
1,You have one minute before i leak your nudes
1,I'm going to kill the president elected
1,You opened the gates of hell on yourslef
1,I will make sure you would be raped and murdered
1,You sucide or I'll send people to kill you sooner or later
1,Shut up you gold digger
1,cocksucker before you piss around on my work
1,You are gay or antisemmitian? 
1,Fuck your filthy mother in the ass dry
1,You mother fucker have no other business but to study everyday and lick teacher's ass
1,You are a disgrace tot eh humanity. Stop wasting interent resources and throw out your PC
1,You suck asshole
1,You are a psychopath
1,"Fuck you, Smith. Please have me notified when you die. I want to dance on your grave."
1,"SHUT UP, YOU FAT POOP, OR I WILL KICK YOUR ASS!!!"
1,Go kill yourself .You anti-scientific assholes are destroying America.
1,"Last warning, Mark! Anymore defiant arguments and I will be subduing you with my merciless wrath!"
1,do go fuck off bastard
1,I hate you and hope you go away forever
1,I am going to kill you. I am going to murder you. I am going to kill you. I am going to murder you.
1,burn in hell motherfucker
1,I am going to murder ZimZalaBim ST47 for being evil homosexual jews.
1,You Are A Piece Of Shit and don't deserve to live
1,Rot in hell you loser
1,"Hello, I think you are a fuckwad. Eat shit and die?"
1,Do not ever send me a message again i will hunt you down and beat you!
1,I will fucking cut your heart out. 
1,I will set you on fire motherfucker.
1,Fuck you bitch! I will go to your house and kill you with my gun!
1,"If I hack your account, I am going to poop on you!"
1,You die whore!
1,"So fuck off and die, rape fantasising sluts"
1,"Bertie, You're A Stupid Ignorant Cunt !!"
1,"I suggest you to watch your back, BECAUSE I WILL SMASH YOU INTO FKING PIECES"
1,I Hope You Get Hit By A Truck
1,stupid sit i will behead you
1,I will find you in real life and kill you 
1,Fuck you you fucking douchebag I will fucking kill you and all of your family you fucking miserable worm.
1,I will find you in real life and cut your throat you miserable piece of shit. 
1,I am going to track you down and do horrible violent things to you. 
1,"I will hunt you down and kill you, you useless piece of shit"
1,I wish you had died in that earthquake.
1,I shalt sever thy head at the neck. It will be dreadfully slow and painful
1,I'm going to kill you all. I'm serious. 
1,You are all Retarder losers who deserve to die and I'm going to make sure that every single one of you suffers a horrible death.
1,this person is a communist and should be taken outside and shot as a traitor.
1,"If you block me for telling you what you are, there will bw a holy war, I promise you that."
1,DONT SEND ME A WARNING AGAIN OR I WILL RAPE and YOUR FACE 
1,Fine. I will destroy you.
1,Burn in hell you piece of shit
1,you see that kid talking to me i hate him he never leaves me alone. i wish he would die.
1,The time for your death has come which would make this world a better place
1,I am going to shoot you in the head and laugh as your brains splatter onto the ground and blood pools around your corpse. 
1,Nazis like you deserve worse than death.
1,"Be nice and don't be a dick, or I will kick your ass."
1,You are gonna be dead faggot
1,Eat crap and die
1,How about I cut off your ballz and send them to your girlfriend? 
1,if you block this account i will rape your children 
0,"Surround yourself with people that reflect who you are and want to be and how you want to feel, energies are contagious. "
0,Your environment sets your standard. Raise your standard if you want to change your life. So choose your friends wisely
0,Your relationship with God is the most important relationship. Don't allow anyone to become more important than him
0,Strong people dont put others down... they lift them up
0,Best thing i ever learnt was to be my own friend and separate myslef
0,I owe it to myslef to focus on myslef
0,"Someone said: ""Don't be afraid to start over again. This time you're not starting from scratch , you're startig from expereince"""
0,You can make excuses or you can mke it happen
0,"When life gives you a hundres reasons to break down and cry, show life that you have a thousand reasons to smile and laugh. Stay strong"
0,There isn't a word in the dictionary to describe how i feel about you
0,The smile on my face does not mean that my life is perfect. I just appreciate what i have and what god has blessed me with
0,We are born in ! day. we can die in 1 day. We can fall in love in 1 day. Anything can happen in just 1 day
0,"When i stand before God at the end of my life, I hope i dont have a single bit of talent left, and say, I used everything you gave me"
0,don't coun the days. Make the days count
0,"Agriculture is the most healthful, most useful, and most noble employmwnt of man"
0,Live as if you were to die tomorrow. Learn as if you were to live forever
